name,caption,type,editor,is_dynamic,default_value,message,validation_rules
D,Demand Rate,Decimal,Numeric,,,Demand rate must be strictly positive. Use the same time unit as the production rate.,1;3;7
A,Ordering/Setup cost,Decimal,Numeric,,,Setup/Ordering cost must be strictly positive.,1;3;7
ii,Holding cost,Decimal,Numeric,,,Holding cost rate must be expressed as a percentage.,1;3;7
C,Unit procurement cost,Decimal,Numeric,,,Unit procurement cost must be strictly positive.,1;3;7
theta,Discount rate net of inflation,Decimal,Numeric,,,Discount rate must be strictly positive.,1;3;7
